{
  "certificate_id": "b13cdl-muon_g2-4dfb0a27ac03",
  "entry_id": "cdl-muon-g2",
  "inputs": {
    "units": "1e-11"
  },
  "notes": "Structural twin of S3-EM (fine-structure Rb/Cs h/m channel): honest refusal is the deliverable, not a limitation. contested: method-dependent.",
  "pipeline": "muon_g2",
  "soundness": {
    "tag": "SOUND"
  },
  "stipulations": [
    {
      "assumed": {
        "sigma_1e-11": 14.5,
        "value_1e-11": 116592071.5
      },
      "name": "exp_2025",
      "source": "Muon g-2 Collab final report (2025)"
    },
    {
      "assumed": {
        "sigma_1e-11": 62.0,
        "value_1e-11": 116592033.0
      },
      "name": "wp25_lattice",
      "source": "Theory Initiative White Paper 2025 (lattice HVP)"
    },
    {
      "assumed": {
        "sigma_1e-11": 43.0,
        "value_1e-11": 116591810.0
      },
      "name": "wp20_datadriven",
      "source": "Theory Initiative White Paper 2020 (e+e- HVP)"
    }
  ],
  "timestamp_utc": "2026-07-15T21:38:15Z",
  "verdict": "NONIDENTIFIABLE(HVP-method): experiment-vs-SM verdict is not method-invariant; pipeline declines a single sigma",
  "verdict_detail": {
    "reading": {
      "exp_vs_wp20": "strong tension (~5.8 sigma) under data-driven HVP",
      "exp_vs_wp25": "agreement (~0.6 sigma) \u2014 no new-physics signal under lattice HVP",
      "wp25_vs_wp20": "the discrepancy lives INSIDE theory (HVP method), not between experiment and theory"
    },
    "tension_matrix_sigma": {
      "exp_vs_wp20": 5.76,
      "exp_vs_wp25": 0.6,
      "wp25_vs_wp20": 2.96
    }
  },
  "witness": {
    "statement": "the two theory branches differ by more than the experiment-theory gap under either branch; verdict identification requires an external selector (MUonE, new e+e- data) \u2014 see falsifiers f-muone, f-ee-hadrons-new",
    "type": "method-branch-divergence"
  }
}