{
  "certificate_id": "b13cdl-h0_tension-09124fd683e7",
  "pipeline": "h0_tension",
  "entry_id": "cdl-h0-tension",
  "timestamp_utc": "2026-07-15T18:12:28Z",
  "soundness": {
    "tag": "SOUND"
  },
  "stipulations": [
    {
      "name": "planck2018_cmb",
      "assumed": {
        "H0": 67.4,
        "sigma": 0.5
      },
      "source": "Planck 2018, A&A 641 A6 (conditional on LCDM)"
    },
    {
      "name": "desi_bao_cmb",
      "assumed": {
        "H0": 67.97,
        "sigma": 0.38
      },
      "source": "DESI BAO + CMB, 2024-25 (conditional on LCDM)"
    },
    {
      "name": "sh0es_2022",
      "assumed": {
        "H0": 73.04,
        "sigma": 1.04
      },
      "source": "Riess et al. ApJL 934 L7 (Cepheid ladder)"
    },
    {
      "name": "ladder_jwst_2025",
      "assumed": {
        "H0": 73.17,
        "sigma": 0.86
      },
      "source": "JWST-era distance-ladder compilation (2025)"
    },
    {
      "name": "cchp_trgb_jagb",
      "assumed": {
        "H0": 69.8,
        "sigma": 1.7
      },
      "source": "Freedman et al. CCHP TRGB/JAGB (JWST)"
    }
  ],
  "inputs": {
    "units": "km/s/Mpc"
  },
  "verdict": "NONIDENTIFIABLE(model-vs-systematic): early- and late-branch H0 are each conditional forward maps; identification requires a branch-independent probe",
  "verdict_detail": {
    "tension_matrix_sigma": {
      "planck2018_cmb__vs__desi_bao_cmb": 0.91,
      "planck2018_cmb__vs__sh0es_2022": 4.89,
      "planck2018_cmb__vs__ladder_jwst_2025": 5.8,
      "planck2018_cmb__vs__cchp_trgb_jagb": 1.35,
      "desi_bao_cmb__vs__sh0es_2022": 4.58,
      "desi_bao_cmb__vs__ladder_jwst_2025": 5.53,
      "desi_bao_cmb__vs__cchp_trgb_jagb": 1.05,
      "sh0es_2022__vs__ladder_jwst_2025": 0.1,
      "sh0es_2022__vs__cchp_trgb_jagb": 1.63,
      "ladder_jwst_2025__vs__cchp_trgb_jagb": 1.77
    },
    "headline_early_vs_late_sigma": 5.8,
    "intra_late_branch_spread_sigma": 1.77,
    "reading": "early-branch pair internally consistent; late branch has method spread (SH0ES vs CCHP); headline tension ~5 sigma and hardening \u2014 JWST crowding checks removed the leading systematic candidate on the ladder side"
  },
  "notes": "Falsifier f-standard-sirens (GW sirens at +/-1 km/s/Mpc) is branch-independent. Couples to cdl-dark-energy-eos (A3): evolving w reshapes the early-branch conditional. contested: intra-branch spread.",
  "witness": {
    "type": "branch-consistency-pattern",
    "statement": "if a single H0 existed and both branches' conditionals held, all pairwise sigmas would be O(1); they are not"
  }
}