{
  "certificate_id": "b13cdl-grh_miller-1103a3a520c8",
  "entry_id": "cdl-rh-grh",
  "inputs": {
    "test_set_size": 8
  },
  "notes": "AKS (2002) provides the unconditional-polynomial-time upgrade path; this pipeline exists to encode the CONDITIONAL(GRH) verdict shape, not for speed.",
  "pipeline": "grh_miller",
  "soundness": {
    "tag": "SOUND"
  },
  "stipulations": [
    {
      "assumed": true,
      "name": "GRH",
      "source": "Stipulated only for PRIME verdicts; COMPOSITE verdicts are unconditional"
    },
    {
      "assumed": "a <= 2*ln(n)^2",
      "name": "witness_bound",
      "source": "Miller (1976); Bach (1990)"
    }
  ],
  "timestamp_utc": "2026-07-15T21:38:15Z",
  "verdict": "Mixed per-n verdicts; see verdict_detail (asymmetry preserved)",
  "verdict_detail": {
    "results": [
      {
        "grh_base_bound": 41,
        "n": "97",
        "verdict": "PRIME CONDITIONAL(GRH)",
        "witness_base": null
      },
      {
        "grh_base_bound": 80,
        "n": "561",
        "verdict": "COMPOSITE (UNCONDITIONAL)",
        "witness_base": 2
      },
      {
        "grh_base_bound": 116,
        "n": "2047",
        "verdict": "COMPOSITE (UNCONDITIONAL)",
        "witness_base": 3
      },
      {
        "grh_base_bound": 399,
        "n": "1373653",
        "verdict": "COMPOSITE (UNCONDITIONAL)",
        "witness_base": 5
      },
      {
        "grh_base_bound": 581,
        "n": "25326001",
        "verdict": "COMPOSITE (UNCONDITIONAL)",
        "witness_base": 7
      },
      {
        "grh_base_bound": 2027,
        "n": "67280421310721",
        "verdict": "PRIME CONDITIONAL(GRH)",
        "witness_base": null
      },
      {
        "grh_base_bound": 958,
        "n": "3215031751",
        "verdict": "COMPOSITE (UNCONDITIONAL)",
        "witness_base": 11
      },
      {
        "grh_base_bound": 3575,
        "n": "2305843009213693951",
        "verdict": "PRIME CONDITIONAL(GRH)",
        "witness_base": null
      }
    ]
  },
  "witness": {
    "statement": "each COMPOSITE row carries a base a that any third party can re-verify with one modular exponentiation chain",
    "type": "miller-witness-bases"
  }
}