{
  "certificate_id": "b13cdl-varying_constants-180a132d6af0",
  "pipeline": "varying_constants",
  "entry_id": "cdl-varying-constants",
  "timestamp_utc": "2026-07-15T18:12:28Z",
  "soundness": {
    "tag": "SOUND"
  },
  "stipulations": [
    {
      "name": "LNH_prediction",
      "assumed": {
        "|Gdot/G|_per_yr": 7e-11
      },
      "source": "Dirac (1937); |Gdot/G| ~ H_0"
    },
    {
      "name": "LLR_measurement",
      "assumed": {
        "central_per_yr": 7.1e-14,
        "sigma_per_yr": 7.6e-14
      },
      "source": "Class. Quantum Grav. 35, 035015 (2018)"
    }
  ],
  "inputs": {
    "n_sigma_exclusion": 5
  },
  "verdict": "REJECTED: Dirac-LNH varying-G prediction excluded",
  "verdict_detail": {
    "llr_bound_5sigma_per_yr": 4.51e-13,
    "lnh_prediction_per_yr": 7e-11,
    "exclusion_margin_orders_of_magnitude": 2.19
  },
  "notes": "Filed as REJECTED per erratum culture, not silently dropped. General varying-constants searches (f-clock-drift) remain live falsifiers for the alpha and mu rows.",
  "witness": {
    "type": "interval-separation",
    "statement": "LNH prediction exceeds the 5-sigma LLR band by ~2.2 orders of magnitude"
  }
}