{
  "certificate_id": "b13cdl-coverage-bb7ea4aa6766",
  "pipeline": "coverage",
  "entry_id": "cdl-rh-grh",
  "timestamp_utc": "2026-07-15T18:12:28Z",
  "soundness": {
    "tag": "SOUND"
  },
  "stipulations": [
    {
      "name": "liveness_rule",
      "assumed": "within 1 OOM = live",
      "source": "Survey Rec-2"
    }
  ],
  "inputs": {
    "n_entries": 25,
    "n_falsifiers": 15
  },
  "verdict": "Uni-column scarcity CONFIRMED; Stage-4 audit PASS; falsifier linkage GAPS: ['A10', 'M4', 'M5', 'M7', 'M8']",
  "verdict_detail": {
    "predicate_counts": {
      "Pos": 9,
      "RG": 7,
      "Cau": 6,
      "Sym": 11,
      "Top": 5,
      "Cmp": 10,
      "Thm": 11,
      "Uni": 1
    },
    "scarce_predicates": [
      "Uni"
    ],
    "saturated_cells": {
      "lambda_H|RG": [
        "A1",
        "A6",
        "A10"
      ],
      "Lambda|Pos": [
        "A2",
        "A3",
        "A15"
      ],
      "initial_parameters|Pos": [
        "A3",
        "A9",
        "A15"
      ],
      "initial_parameters|Cau": [
        "A3",
        "A9",
        "A15"
      ],
      "alpha|Sym": [
        "A5",
        "A12",
        "A14"
      ],
      "G|RG": [
        "A10",
        "A12",
        "A15"
      ]
    },
    "falsifier_liveness": {
      "f-top-mass-ee": "live",
      "f-nedm-next": "latent (gap 1.3 OOM)",
      "f-clock-drift": "latent (gap 1.0 OOM)",
      "f-llr-g": "closed_decisive",
      "f-muone": "live",
      "f-ee-hadrons-new": "live",
      "f-standard-sirens": "live",
      "f-stage5-spectroscopy": "live",
      "f-hyperk-dune": "live",
      "f-0vbb-tonne": "live",
      "f-zero-off-line": "live",
      "f-poly-sat-solver": "live",
      "f-abc-triple": "live",
      "f-ramanujan-violation": "live",
      "f-beat-gw": "live"
    },
    "bidirectional_entries_without_falsifiers": [
      "A10",
      "M4",
      "M5",
      "M7",
      "M8"
    ],
    "admission_rule": "ADMIT new entry iff it (a) touches a block x predicate cell with < 3 current entries, or (b) supplies a new compute hook (pipeline) for an existing cell. Otherwise DEPRIORITIZE."
  },
  "notes": "Meta-certificate over the ledger, not over a physical/mathematical claim."
}